{
    "node_name": "INVERTER_D",
    "bus_name": "MCAN",
    "tx": [
        {
            "message_name": "INVD_CRIT",
            "description": "Actual speed, torque and motor/inverter I2t overload at 100 Hz",
            "signals": [
                {
                    "signal_name": "AMK_ActualSpeed",
                    "description": "AMK special signal 5: actual motor speed (1 rpm per count)",
                    "data_type": "int16_t",
                    "unit": "rpm"
                },
                {
                    "signal_name": "AMK_ActualTorque",
                    "description": "AMK special signal 19: actual torque relative to ID32771 nominal motor torque (0.1% per count)",
                    "data_type": "int16_t",
                    "unit": "%",
                    "scale": 0.1
                },
                {
                    "signal_name": "AMK_DisplayOverloadInverter",
                    "data_type": "uint16_t",
                    "unit": "%",
                    "scale": 0.1,
                    "description": "AMK SERCOS ID33101: inverter I2t overload (0.1% per count)"
                },
                {
                    "signal_name": "AMK_DisplayOverloadMotor",
                    "data_type": "uint16_t",
                    "unit": "%",
                    "scale": 0.1,
                    "description": "AMK SERCOS ID33102: motor I2t overload (0.1% per count)"
                }
            ],
            "period_ms": 10,
            "id_override": "0x124",
            "priority": 1,
            "byte_order": "little_endian"
        },
        {
            "message_name": "INVD_INFO",
            "description": "AMK special signal 3: 16-bit status word at 2 Hz",
            "signals": [
                {
                    "signal_name": "AMK_Status_bReserve",
                    "description": "Status word: RESERVED",
                    "data_type": "uint8_t",
                    "length": 8
                },
                {
                    "signal_name": "AMK_Status_bSystemReady",
                    "description": "Status word: system ready",
                    "data_type": "bool"
                },
                {
                    "signal_name": "AMK_Status_bError",
                    "description": "Status word: error",
                    "data_type": "bool"
                },
                {
                    "signal_name": "AMK_Status_bWarn",
                    "description": "Status word: warning",
                    "data_type": "bool"
                },
                {
                    "signal_name": "AMK_Status_bQuitDcOn",
                    "description": "Status word: HV activation ACK",
                    "data_type": "bool"
                },
                {
                    "signal_name": "AMK_Status_bDcOn",
                    "description": "Status word: HV activation level",
                    "data_type": "bool"
                },
                {
                    "signal_name": "AMK_Status_bQuitInverterOn",
                    "description": "Status word: Controller enable ACK",
                    "data_type": "bool"
                },
                {
                    "signal_name": "AMK_Status_bInverterOn",
                    "description": "Status word: Controller enable level",
                    "data_type": "bool"
                },
                {
                    "signal_name": "AMK_Status_bDerating",
                    "description": "Status word: torque limit activation",
                    "data_type": "bool"
                }
            ],
            "period_ms": 500,
            "id_override": "0x234",
            "priority": 2,
            "byte_order": "little_endian"
        },
        {
            "message_name": "INVD_ERR_1",
            "description": "AMK diagnostic number and additional information at 2 Hz",
            "signals": [
                {
                    "signal_name": "AMK_DiagnosticNumber",
                    "description": "AMK special signal 21: diagnostic number (unsigned 32-bit)",
                    "data_type": "uint32_t"
                },
                {
                    "signal_name": "AMK_ErrorInfo1",
                    "description": "AMK special signal 22: diagnostic additional information 1 (unsigned 32-bit)",
                    "data_type": "uint32_t"
                }
            ],
            "period_ms": 500,
            "id_override": "0x444",
            "priority": 4,
            "byte_order": "little_endian"
        },
        {
            "message_name": "INVD_ERR_2",
            "description": "AMK diagnostic additional information at 2 Hz",
            "signals": [
                {
                    "signal_name": "AMK_ErrorInfo2",
                    "description": "AMK special signal 23: diagnostic additional information 2 (unsigned 32-bit)",
                    "data_type": "uint32_t"
                },
                {
                    "signal_name": "AMK_ErrorInfo3",
                    "description": "AMK special signal 24: diagnostic additional information 3 (unsigned 32-bit)",
                    "data_type": "uint32_t"
                }
            ],
            "period_ms": 500,
            "id_override": "0x454",
            "priority": 4,
            "byte_order": "little_endian"
        },
        {
            "message_name": "INVD_TEMPS",
            "description": "Motor, inverter cold plate and IGBT temperatures at 10 Hz",
            "signals": [
                {
                    "signal_name": "AMK_MotorTemp",
                    "description": "AMK special signal 7: motor temperature (0.1 C per count)",
                    "data_type": "int16_t",
                    "unit": "C",
                    "scale": 0.1
                },
                {
                    "signal_name": "AMK_InverterTemp",
                    "description": "AMK special signal 8: inverter cold plate temperature (0.1 C per count)",
                    "data_type": "int16_t",
                    "unit": "C",
                    "scale": 0.1
                },
                {
                    "signal_name": "AMK_IGBTTemp",
                    "description": "AMK special signal 27: IGBT temperature (0.1 C per count)",
                    "data_type": "int16_t",
                    "unit": "C",
                    "scale": 0.1
                }
            ],
            "period_ms": 100,
            "id_override": "0x564",
            "priority": 5,
            "byte_order": "little_endian"
        },
        {
            "message_name": "INVD_PHASE_I",
            "description": "Motor phase U current at 100 Hz",
            "signals": [
                {
                    "signal_name": "AMK_PhaseUCurrent",
                    "description": "AMK SERCOS ID32828: instantaneous motor phase U current (0.01 A per count)",
                    "data_type": "int32_t",
                    "unit": "A",
                    "scale": 0.01
                }
            ],
            "period_ms": 10,
            "id_override": "0x574",
            "priority": 5,
            "byte_order": "little_endian"
        },
        {
            "message_name": "INVD_POWER",
            "description": "Electrical active power and DC bus voltage at 100 Hz",
            "signals": [
                {
                    "signal_name": "AMK_ActualElectricalPower",
                    "description": "AMK SERCOS ID33171: electrical active power; positive motoring, negative regeneration (1 W per count)",
                    "data_type": "int32_t",
                    "unit": "W"
                },
                {
                    "signal_name": "AMK_DCBusVoltage",
                    "description": "AMK SERCOS ID32836: DC bus voltage (1 V per count)",
                    "data_type": "uint16_t",
                    "unit": "V"
                }
            ],
            "period_ms": 10,
            "id_override": "0x584",
            "priority": 5,
            "byte_order": "little_endian"
        }
    ],
    "rx": [
        {
            "message_name": "INVD_SET"
        }
    ]
}
