{
    "node_name": "INVERTER_A",
    "bus_name": "MCAN",
    "tx": [
        {
            "message_name": "INVA_CRIT",
            "description": "Contains the status word and actual values",
            "signals": [
                {
                    "signal_name": "AMK_ActualSpeed",
                    "description": "Actual speed value",
                    "data_type": "int16_t",
                    "unit": "rpm"
                },
                {
                    "signal_name": "AMK_ActualTorque",
                    "description": "Actual torque value",
                    "data_type": "int16_t",
                    "unit": "%",
                    "scale": 0.1
                },
                {
                    "signal_name": "AMK_DisplayOverloadInverter",
                    "data_type": "uint16_t",
                    "scale": 0.1,
                    "unit": "%"
                },
                {
                    "signal_name": "AMK_DisplayOverloadMotor",
                    "data_type": "uint16_t",
                    "scale": 0.1,
                    "unit": "%"
                }
            ],
            "period_ms": 15,
            "id_override": "0x121",
            "priority": 1
        },
        {
            "message_name": "INVA_INFO",
            "description": "Contains the status word and actual values",
            "signals": [
                {
                    "signal_name": "AMK_Status_bReserve",
                    "description": "Status word: RESERVED",
                    "data_type": "uint8_t",
                    "length": 8
                },
                {
                    "signal_name": "AMK_Status_bSystemReady",
                    "description": "Status word: system ready",
                    "data_type": "bool"
                },
                {
                    "signal_name": "AMK_Status_bError",
                    "description": "Status word: error",
                    "data_type": "bool"
                },
                {
                    "signal_name": "AMK_Status_bWarn",
                    "description": "Status word: warning",
                    "data_type": "bool"
                },
                {
                    "signal_name": "AMK_Status_bQuitDcOn",
                    "description": "Status word: HV activation ACK",
                    "data_type": "bool"
                },
                {
                    "signal_name": "AMK_Status_bDcOn",
                    "description": "Status word: HV activation level",
                    "data_type": "bool"
                },
                {
                    "signal_name": "AMK_Status_bQuitInverterOn",
                    "description": "Status word: Controller enable ACK",
                    "data_type": "bool"
                },
                {
                    "signal_name": "AMK_Status_bInverterOn",
                    "description": "Status word: Controller enable level",
                    "data_type": "bool"
                },
                {
                    "signal_name": "AMK_Status_bDerating",
                    "description": "Status word: torque limit activation",
                    "data_type": "bool"
                },
                {
                    "signal_name": "AMK_DCBusVoltage",
                    "description": "Voltage of the DC bus",
                    "data_type": "uint16_t",
                    "unit": "V"
                }
            ],
            "period_ms": 500,
            "id_override": "0x231",
            "priority": 2
        },
        {
            "message_name": "INVA_ERR_1",
            "description": "All error information",
            "signals": [
                {
                    "signal_name": "AMK_DiagnosticNumber",
                    "description": "Error number",
                    "data_type": "uint32_t"
                },
                {
                    "signal_name": "AMK_ErrorInfo1",
                    "description": "Error info",
                    "data_type": "uint32_t"
                }
            ],
            "period_ms": 2000,
            "id_override": "0x441",
            "priority": 4
        },
        {
            "message_name": "INVA_ERR_2",
            "description": "All error information",
            "signals": [
                {
                    "signal_name": "AMK_ErrorInfo2",
                    "description": "Error info",
                    "data_type": "uint32_t"
                },
                {
                    "signal_name": "AMK_ErrorInfo3",
                    "description": "Error info",
                    "data_type": "uint32_t"
                }
            ],
            "period_ms": 2000,
            "id_override": "0x451",
            "priority": 4
        },
        {
            "message_name": "INVA_TEMPS",
            "description": "Contains temperatures",
            "signals": [
                {
                    "signal_name": "AMK_MotorTemp",
                    "description": "Motor temperature",
                    "data_type": "int16_t",
                    "unit": "C",
                    "scale": 0.1
                },
                {
                    "signal_name": "AMK_InverterTemp",
                    "description": "Inverter cold plate temperature",
                    "data_type": "int16_t",
                    "unit": "C",
                    "scale": 0.1
                },
                {
                    "signal_name": "AMK_IGBTTemp",
                    "description": "IGBT temperature",
                    "data_type": "int16_t",
                    "unit": "C",
                    "scale": 0.1
                }
            ],
            "period_ms": 500,
            "id_override": "0x461",
            "priority": 4
        },
        {
            "message_name": "INVA_PHASE_I",
            "description": "All error information",
            "signals": [
                {
                    "signal_name": "AMK_PhaseUCurrent",
                    "description": "INVA Phase U Current",
                    "data_type": "int32_t"
                }
            ],
            "period_ms": 250,
            "id_override": "0x571",
            "priority": 4
        }
    ],
    "rx": [
        {
            "message_name": "INVA_SET"
        }
    ]
}
