{
    "node_name": "IZZE_IMU",
    "bus_name": "VCAN",
    "tx": [
        {
            "message_name": "IZZE_angular_rate",
            "description": "Angular Rate",
            "byte_order": "big_endian",
            "signals": [
                {
                    "signal_name": "X_axis",
                    "description": "Angular Rate around X-axis",
                    "data_type": "int16_t",
                    "unit": "deg/s",
                    "scale": 0.1
                },
                {
                    "signal_name": "Y_axis",
                    "description": "Angular Rate around Y-axis",
                    "data_type": "int16_t",
                    "unit": "deg/s",
                    "scale": 0.1
                },
                {
                    "signal_name": "Z_axis",
                    "description": "Angular Rate around Z-axis",
                    "data_type": "int16_t",
                    "unit": "deg/s",
                    "scale": 0.1
                },
                {
                    "signal_name": "reserved",
                    "description": "reserved",
                    "data_type": "uint16_t"
                }
            ],
            "period_ms": 50,
            "id_override": "0x4EC",
            "priority": 5
        },
        {
            "message_name": "IZZE_acceleration",
            "description": "Acceleration",
            "byte_order": "big_endian",
            "signals": [
                {
                    "signal_name": "X_axis",
                    "description": "Acceleration along X-axis",
                    "data_type": "int16_t",
                    "unit": "g",
                    "scale": 0.01
                },
                {
                    "signal_name": "Y_axis",
                    "description": "Acceleration along Y-axis",
                    "data_type": "int16_t",
                    "unit": "g",
                    "scale": 0.01
                },
                {
                    "signal_name": "Z_axis",
                    "description": "Acceleration along Z-axis",
                    "data_type": "int16_t",
                    "unit": "g",
                    "scale": 0.01
                },
                {
                    "signal_name": "temperature",
                    "description": "IMU Temperature",
                    "data_type": "int16_t",
                    "unit": "C",
                    "scale": 0.1
                }
            ],
            "period_ms": 50,
            "id_override": "0x4ED",
            "priority": 5
        }
    ],
    "rx": []
}
