{
    "node_name": "BOSCH_LWS",
    "bus_name": "VCAN",
    "tx": [
        {
            "message_name": "LWS_Standard",
            "description": "Standard steering angle and speed",
            "signals": [
                {
                    "signal_name": "LWS_ANGLE",
                    "description": "Steering Angle",
                    "data_type": "int16_t",
                    "unit": "deg",
                    "scale": 0.1
                },
                {
                    "signal_name": "LWS_SPEED",
                    "description": "Angular speed of steering input",
                    "data_type": "uint8_t",
                    "unit": "deg/s",
                    "scale": 4
                },
                {
                    "signal_name": "OK",
                    "description": "Sensor failure status, 0 = failure, 1 = OK",
                    "data_type": "bool"
                },
                {
                    "signal_name": "CAL",
                    "description": "Sensor calibration status, 0 = uncalibrated, 1 = calibrated",
                    "data_type": "bool"
                },
                {
                    "signal_name": "TRIM",
                    "description": "Sensor trim status, 0 = invalid, 1 = valid",
                    "data_type": "bool"
                },
                {
                    "signal_name": "reserved1",
                    "data_type": "uint8_t",
                    "length": 5
                },
                {
                    "signal_name": "reserved2",
                    "data_type": "uint8_t",
                    "length": 8
                }
            ],
            "period_ms": 10,
            "id_override": "0x2B0",
            "priority": 5
        }
    ],
    "rx": []
}
